{"$id":"https://cheapinfra-resources.wyrdwerk.com/api/v1/schemas/taxonomy.schema.json","$schema":"https://json-schema.org/draft/2020-12/schema","additionalProperties":false,"description":"One file per facet. Every slug carries a label, definition, status, and optional aliases.","properties":{"$id":{"type":"string"},"cardinality":{"type":"string"},"facet":{"enum":["resource_type","topics","use_cases","interfaces","technologies"]},"note":{"type":"string"},"values":{"minProperties":1,"patternProperties":{"^[a-z0-9][a-z0-9-]{1,60}$":{"additionalProperties":false,"properties":{"aliases":{"items":{"minLength":1,"type":"string"},"type":"array","uniqueItems":true},"definition":{"minLength":1,"type":"string"},"label":{"minLength":1,"type":"string"},"status":{"enum":["active","deprecated"]}},"required":["label","definition","status"],"type":"object"}},"type":"object"}},"required":["$id","facet","cardinality","values"],"title":"Taxonomy registry file","type":"object"}