{"$id":"https://cheapinfra-resources.wyrdwerk.com/api/v1/taxonomy/topics.json","cardinality":"one-to-five","facet":"topics","values":{"ai-agents":{"aliases":["agents","agent-framework","ai-agent"],"definition":"Autonomous or semi-autonomous AI agents, agent frameworks, harnesses, and skills.","label":"AI agents","status":"active"},"app-development":{"aliases":["desktop-apps","mobile"],"definition":"Building desktop, mobile, or general-purpose applications.","label":"App development","status":"active"},"backend":{"aliases":["server-side","api-development"],"definition":"Server-side application logic, APIs, and services.","label":"Backend","status":"active"},"cloud-infrastructure":{"aliases":["cloud","hosting","vps"],"definition":"Cloud platforms, hosting, VMs, and infrastructure services.","label":"Cloud infrastructure","status":"active"},"databases":{"aliases":["db","database","sql"],"definition":"Databases, query engines, ORMs, and data storage.","label":"Databases","status":"active"},"design":{"aliases":["ui-design","ux","design-systems"],"definition":"UI/UX design, design systems, and visual resources.","label":"Design","status":"active"},"developer-tools":{"aliases":["devtools","dev-tools","dx"],"definition":"Tooling that helps developers write, review, debug, or ship code.","label":"Developer tools","status":"active"},"devops":{"aliases":["ci-cd","cicd","operations"],"definition":"CI/CD, automation, deployment pipelines, and operations tooling.","label":"DevOps","status":"active"},"frontend":{"aliases":["front-end","client-side","web-ui"],"definition":"Client-side web development: components, styling, and browser UI.","label":"Frontend","status":"active"},"inference":{"aliases":["model-serving","llm-inference"],"definition":"Running AI models: inference engines, serving, and providers.","label":"Inference","status":"active"},"observability":{"aliases":["monitoring","logging","tracing"],"definition":"Monitoring, logging, tracing, and system visibility.","label":"Observability","status":"active"},"productivity":{"aliases":["notes","pkm"],"definition":"Personal and team productivity, notes, and workflows.","label":"Productivity","status":"active"},"security":{"aliases":["appsec","infosec"],"definition":"Application and infrastructure security tooling and practices.","label":"Security","status":"active"},"self-hosting":{"aliases":["selfhosted","homelab"],"definition":"Self-hosted software and homelab infrastructure.","label":"Self-hosting","status":"active"},"testing":{"aliases":["test","qa"],"definition":"Software testing frameworks, harnesses, and practices.","label":"Testing","status":"active"},"web-development":{"aliases":["webdev","web-dev"],"definition":"General web development spanning frontend and backend.","label":"Web development","status":"active"}}}