{"$id":"https://cheapinfra-resources.wyrdwerk.com/api/v1/taxonomy/technologies.json","cardinality":"zero-to-eight","facet":"technologies","note":"Product and ecosystem names live here, not in topics (governance rule 3). Additive: new slugs may be appended; never rename without an alias.","values":{"anthropic-api":{"aliases":["claude-api"],"definition":"Anthropic's Claude API.","label":"Anthropic API","status":"active"},"claude-code":{"aliases":[],"definition":"Anthropic's Claude Code agentic coding tool.","label":"Claude Code","status":"active"},"docker":{"aliases":[],"definition":"Docker container platform.","label":"Docker","status":"active"},"electron":{"aliases":[],"definition":"Electron desktop-app framework.","label":"Electron","status":"active"},"github-actions":{"aliases":["gha"],"definition":"GitHub Actions CI/CD.","label":"GitHub Actions","status":"active"},"go":{"aliases":["golang"],"definition":"The Go programming language.","label":"Go","status":"active"},"javascript":{"aliases":["js","ecmascript"],"definition":"The JavaScript language.","label":"JavaScript","status":"active"},"kubernetes":{"aliases":["k8s"],"definition":"Kubernetes container orchestration.","label":"Kubernetes","status":"active"},"mcp-protocol":{"aliases":["model-context-protocol"],"definition":"The Model Context Protocol standard.","label":"MCP protocol","status":"active"},"neovim":{"aliases":["nvim"],"definition":"Neovim text editor.","label":"Neovim","status":"active"},"next-js":{"aliases":["nextjs"],"definition":"The Next.js React framework.","label":"Next.js","status":"active"},"node-js":{"aliases":["nodejs","node"],"definition":"The Node.js runtime.","label":"Node.js","status":"active"},"ollama":{"aliases":[],"definition":"Ollama local model runner.","label":"Ollama","status":"active"},"openai-api":{"aliases":[],"definition":"OpenAI's API platform.","label":"OpenAI API","status":"active"},"postgres":{"aliases":["postgresql"],"definition":"PostgreSQL database.","label":"PostgreSQL","status":"active"},"python":{"aliases":["py"],"definition":"The Python language.","label":"Python","status":"active"},"react":{"aliases":[],"definition":"The React UI library.","label":"React","status":"active"},"rust":{"aliases":[],"definition":"The Rust language.","label":"Rust","status":"active"},"sqlite":{"aliases":[],"definition":"SQLite embedded database.","label":"SQLite","status":"active"},"svelte":{"aliases":[],"definition":"The Svelte UI framework.","label":"Svelte","status":"active"},"tailwind-css":{"aliases":["tailwind"],"definition":"Tailwind CSS utility framework.","label":"Tailwind CSS","status":"active"},"typescript":{"aliases":["ts"],"definition":"The TypeScript language.","label":"TypeScript","status":"active"},"vscode":{"aliases":["visual-studio-code"],"definition":"Visual Studio Code editor.","label":"VS Code","status":"active"},"vue":{"aliases":["vuejs"],"definition":"The Vue.js framework.","label":"Vue","status":"active"},"zed":{"aliases":[],"definition":"The Zed editor.","label":"Zed","status":"active"}}}